REPRODUCIBLE VERSION/cprsat_5fold_results.csv

Top-1_mean,Top-1_std,Top-9_mean,Top-9_std,Top-18_mean,Top-18_std,Top-25_mean,Top-25_std,Top-36_mean,Top-36_std
0.904907304303659,0.0174307245746684,0.9641768739377602,0.015664536025052852,0.9734679325636367,0.01152252875726446,0.9765613706069664,0.009946549852030721,0.978331282111391,0.0097253071100152

REPRODUCIBLE VERSION/readme.md

Top-1_mean: 0.9049
Top-1_std: 0.0174
Top-9_mean: 0.9642
Top-9_std: 0.0157
Top-18_mean: 0.9735
Top-18_std: 0.0115
Top-25_mean: 0.9766
Top-25_std: 0.0099
Top-36_mean: 0.9783
Top-36_std: 0.0097